{
  "$schema": "https://json-schema.org/draft/2020-12/schema",
  "$id": "https://github.com/loozy5331/virtual-shipyard-simulator/schemas/envelope.json",
  "title": "이벤트 봉투 v0",
  "description": "모든 이벤트가 담기는 봉투. 0단계에서 고정하고 이후에는 event_type과 payload 필드를 더하기만 한다.",
  "type": "object",
  "properties": {
    "event_id": {
      "type": "string",
      "pattern": "^[0-9a-f]{8}-[0-9a-f]{4}-7[0-9a-f]{3}-[89ab][0-9a-f]{3}-[0-9a-f]{12}$",
      "description": "UUID v7. 중복 방출도 같은 값이라 멱등 처리 키가 된다"
    },
    "event_type": {
      "enum": [
        "order.contracted",
        "block.process_started",
        "block.process_completed",
        "hull.process_started",
        "hull.process_completed",
        "hull.milestone_reached",
        "equipment.status_changed",
        "system.manifest_published"
      ],
      "description": "대상.동사_과거형"
    },
    "schema_version": {
      "type": "integer",
      "minimum": 1,
      "description": "이벤트 종류별 버전"
    },
    "source": {
      "enum": [
        "erp",
        "mes",
        "eam"
      ],
      "description": "보낸 시스템"
    },
    "occurred_at": {
      "type": "string",
      "pattern": "^\\d{4}-\\d{2}-\\d{2}T\\d{2}:\\d{2}:\\d{2}\\+09:00$",
      "description": "시뮬레이션 세계에서 일어난 시각"
    },
    "emitted_at": {
      "type": "string",
      "pattern": "^\\d{4}-\\d{2}-\\d{2}T\\d{2}:\\d{2}:\\d{2}\\+09:00$",
      "description": "방출기가 보낸 시각. occurred_at과의 차이가 지연 도착"
    },
    "run_id": {
      "type": "string",
      "minLength": 1,
      "description": "실행 하나(시드 + params 버전)"
    },
    "entity_key": {
      "type": "string",
      "minLength": 1,
      "description": "순서를 매기는 대상(호선·블록·설비)"
    },
    "seq": {
      "type": "integer",
      "minimum": 1,
      "description": "entity_key별 1, 2, 3…"
    },
    "hull_no": {
      "type": [
        "string",
        "null"
      ],
      "pattern": "^H-\\d{4}$",
      "description": "가상 호선 번호. 설비 이벤트는 null"
    },
    "block_id": {
      "type": [
        "string",
        "null"
      ],
      "pattern": "^H-\\d{4}-B\\d{3}$"
    },
    "process": {
      "enum": [
        "steel_fabrication",
        "block_assembly",
        "erection",
        "quay_outfitting",
        "sea_trial",
        null
      ]
    },
    "resource_id": {
      "type": [
        "string",
        "null"
      ],
      "pattern": "^[A-Z]+-\\d+$",
      "description": "예: FAB-1, ASM-3, DOCK-1"
    },
    "payload": {
      "type": "object"
    }
  },
  "required": [
    "event_id",
    "event_type",
    "schema_version",
    "source",
    "occurred_at",
    "emitted_at",
    "run_id",
    "entity_key",
    "seq",
    "hull_no",
    "block_id",
    "process",
    "resource_id",
    "payload"
  ],
  "additionalProperties": false,
  "allOf": [
    {
      "if": {
        "properties": {
          "event_type": {
            "const": "order.contracted"
          }
        }
      },
      "then": {
        "properties": {
          "source": {
            "const": "erp"
          },
          "payload": {
            "$ref": "payloads/order.contracted.json"
          },
          "block_id": {
            "type": "null"
          },
          "process": {
            "type": "null"
          },
          "resource_id": {
            "type": "null"
          },
          "hull_no": {
            "type": "string"
          }
        }
      }
    },
    {
      "if": {
        "properties": {
          "event_type": {
            "const": "block.process_started"
          }
        }
      },
      "then": {
        "properties": {
          "source": {
            "const": "mes"
          },
          "payload": {
            "$ref": "payloads/block.process_started.json"
          },
          "block_id": {
            "type": "string"
          },
          "process": {
            "type": "string"
          },
          "resource_id": {
            "type": "string"
          },
          "hull_no": {
            "type": "string"
          }
        }
      }
    },
    {
      "if": {
        "properties": {
          "event_type": {
            "const": "block.process_completed"
          }
        }
      },
      "then": {
        "properties": {
          "source": {
            "const": "mes"
          },
          "payload": {
            "$ref": "payloads/block.process_completed.json"
          },
          "block_id": {
            "type": "string"
          },
          "process": {
            "type": "string"
          },
          "resource_id": {
            "type": "string"
          },
          "hull_no": {
            "type": "string"
          }
        }
      }
    },
    {
      "if": {
        "properties": {
          "event_type": {
            "const": "hull.process_started"
          }
        }
      },
      "then": {
        "properties": {
          "source": {
            "const": "mes"
          },
          "payload": {
            "$ref": "payloads/hull.process_started.json"
          },
          "block_id": {
            "type": "null"
          },
          "process": {
            "type": "string"
          },
          "resource_id": {
            "type": "string"
          },
          "hull_no": {
            "type": "string"
          }
        }
      }
    },
    {
      "if": {
        "properties": {
          "event_type": {
            "const": "hull.process_completed"
          }
        }
      },
      "then": {
        "properties": {
          "source": {
            "const": "mes"
          },
          "payload": {
            "$ref": "payloads/hull.process_completed.json"
          },
          "block_id": {
            "type": "null"
          },
          "process": {
            "type": "string"
          },
          "resource_id": {
            "type": "string"
          },
          "hull_no": {
            "type": "string"
          }
        }
      }
    },
    {
      "if": {
        "properties": {
          "event_type": {
            "const": "hull.milestone_reached"
          }
        }
      },
      "then": {
        "properties": {
          "source": {
            "const": "mes"
          },
          "payload": {
            "$ref": "payloads/hull.milestone_reached.json"
          },
          "block_id": {
            "type": "null"
          },
          "process": {
            "type": "null"
          },
          "hull_no": {
            "type": "string"
          }
        }
      }
    },
    {
      "if": {
        "properties": {
          "event_type": {
            "const": "equipment.status_changed"
          }
        }
      },
      "then": {
        "properties": {
          "source": {
            "const": "eam"
          },
          "payload": {
            "$ref": "payloads/equipment.status_changed.json"
          },
          "block_id": {
            "type": "null"
          },
          "process": {
            "type": "null"
          },
          "resource_id": {
            "type": "string"
          },
          "hull_no": {
            "type": "null"
          }
        }
      }
    },
    {
      "if": {
        "properties": {
          "event_type": {
            "const": "system.manifest_published"
          }
        }
      },
      "then": {
        "properties": {
          "payload": {
            "$ref": "payloads/system.manifest_published.json"
          },
          "hull_no": {
            "type": "null"
          },
          "block_id": {
            "type": "null"
          },
          "process": {
            "type": "null"
          },
          "resource_id": {
            "type": "null"
          }
        }
      }
    }
  ]
}
