{
  "event_id": "0192f3a0-0008-7abc-8def-0123456789ab",
  "event_type": "system.manifest_published",
  "schema_version": 1,
  "source": "mes",
  "occurred_at": "2027-02-11T00:00:00+09:00",
  "emitted_at": "2027-02-11T00:00:00+09:00",
  "run_id": "v0-42",
  "entity_key": "MANIFEST-MES",
  "seq": 101,
  "hull_no": null,
  "block_id": null,
  "process": null,
  "resource_id": null,
  "payload": {
    "lookback_days": 30,
    "last_seq": {
      "H-2601": 7,
      "H-2601-B001": 4
    }
  }
}
