{
  "event_id": "0192f3a0-0006-7abc-8def-0123456789ab",
  "event_type": "hull.milestone_reached",
  "schema_version": 1,
  "source": "mes",
  "occurred_at": "2027-09-03T17:00:00+09:00",
  "emitted_at": "2027-09-03T17:00:00+09:00",
  "run_id": "v0-42",
  "entity_key": "H-2601",
  "seq": 5,
  "hull_no": "H-2601",
  "block_id": null,
  "process": null,
  "resource_id": null,
  "payload": {
    "milestone": "launching"
  }
}
